,Unnamed: 0,Job Title,Salary Estimate,Job Description,Rating,Company Name,Location,Size,Founded,Type of ownership,Industry,Sector,Revenue,hourly,employer provided,min_salary,max_salary,avg_salary,job_state,city,age,python_yn,r_yn
653,653,Machine Learning Engineer,USD 77K - 113K (Glassdoor est.),Demonstrated success applying advanced statistical methods and machine learning algorithms to production/field data using Python or R.…,3.2,Howmet Aerospace,"Whitehall, MI",Unknown,1888,Company - Public,Aerospace & Defense,Aerospace & Defense,Unknown / Non-Applicable,0,0,77,113.0,95.0, MI,Whitehall,136,1,0
656,656,Senior AI Engineer,USD 175K - 200K (Employer est.),"Bachelor's degree in Computer Science, Engineering, or related field. Design and develop new AI/ML algorithms and solutions. Expertise in Python and TensorFlow.…",4.1,CyberCoders,"Belmont, CA",201 to 500 Employees,1999,Subsidiary or Business Segment,Staffing & Subcontracting,Human Resources & Staffing,$100 to $500 million (USD),0,0,175,200.0,187.5, CA,Belmont,25,1,0
657,657,Computer AI Engineer,USD 71K - 111K (Glassdoor est.),Strong problem-solving skills with an emphasis on manufacturing and process/product engineering. Developing vision models and data algorithms to increase and……,3.2,Howmet Aerospace,"Whitehall, MI",Unknown,1888,Company - Public,Aerospace & Defense,Aerospace & Defense,Unknown / Non-Applicable,0,0,71,111.0,91.0, MI,Whitehall,136,0,0
658,658,Machine Learning Engineer/San Francisco Bay area - Contractor,USD 63.00 - 83.00 Per Hour (Employer est.),"2-4+ years of experience performing data analysis; or 2+ years of experience performing data analysis and a Master's degree or PhD in statistics, math, physical……",3.8,EY,"San Francisco, CA",10000+ Employees,1989,Company - Private,Accounting & Tax,Financial Services,$10+ billion (USD),1,0,63,83.0,73.0, CA,San Francisco,35,0,0
659,659,Staff Machine Learning Engineer - Seattle,USD 235K - 270K (Employer est.),"Bachelor’s degree in Computer Science, a similar technical field of study or equivalent practical experience. In the US, access generous retirement plans like a……",3.7,Rokt,"Seattle, WA",201 to 500 Employees,2012,Company - Private,Internet & Web Services,Information Technology,Unknown / Non-Applicable,0,0,235,270.0,252.5, WA,Seattle,12,0,0
660,660,"Engineer, Generative AI",USD 160K - 190K (Employer est.),"Conduct research, design, and develop generative AI-driven features and experiences customized to the unique preferences and behaviors of our users.…",3.7,Vagaro,"Pleasanton, CA",201 to 500 Employees,2009,Company - Private,Internet & Web Services,Information Technology,Unknown / Non-Applicable,0,0,160,190.0,175.0, CA,Pleasanton,15,0,0
661,661,Senior Data Scientist - AI SFL Scientific,USD 99K - 133K (Glassdoor est.),"Design, develop and apply state-of-the-art methods within AI and machine learning, including the utilization of GANs, CNNs, RNNs, LSTMs, BERT, and other models……",4.0,Deloitte,"Rosslyn, VA",10000+ Employees,1850,Company - Private,Business Consulting,Management & Consulting,$10+ billion (USD),0,0,99,133.0,116.0, VA,Rosslyn,174,0,0
662,662,Data Scientist,USD 97K - 160K (Glassdoor est.),10+ years’ experience in Data Science or related field. The incumbent will assist with definition and implementation of data analysis and data modeling……,3.2,Quirch Foods,"Coral Gables, FL",201 to 500 Employees,1967,Company - Private,Wholesale,Retail & Wholesale,$500 million to $1 billion (USD),0,0,97,160.0,128.5, FL,Coral Gables,57,0,0
663,663,Sr Data Scientist - AI/ML,USD 91K - 130K (Glassdoor est.),"Strong business orientation and problem-solving skills with great attention to details; Ability to solve complex problems using creative ideas, state-of-the-art……",3.4,Kelly,"West Chester, PA",5001 to 10000 Employees,1946,Company - Public,HR Consulting,Human Resources & Staffing,$5 to $10 billion (USD),0,0,91,130.0,110.5, PA,West Chester,78,0,0
664,664,Senior Data Analyst/Scientist,USD 50.00 - 55.00 Per Hour (Employer est.),Create and implement data scraping/mining tools and workflows. Help the team meet data analysis project deliverables. Create data visualizations with Power BI.…,4.1,CyberCoders,"Dallas, TX",201 to 500 Employees,1999,Subsidiary or Business Segment,Staffing & Subcontracting,Human Resources & Staffing,$100 to $500 million (USD),1,0,50,55.0,52.5, TX,Dallas,25,0,0
667,667,Data Visualization PowerBI Developer,USD 77K - 105K (Glassdoor est.),"Perform technical risk analysis and reliability assessments. The Artificial Intelligence & Data Engineering team leverages the power of data, analytics,……",4.0,Deloitte,"Mechanicsburg, PA",10000+ Employees,1850,Company - Private,Business Consulting,Management & Consulting,$10+ billion (USD),0,0,77,105.0,91.0, PA,Mechanicsburg,174,0,0
669,669,"Data Science, Advisor",USD 146K - 234K (Employer est.),"Requires strong technical and computational skills - engineering, physics, mathematics, coupled with the ability to collaborate with the customer and management……",3.6,Peraton,"Washington, DC",10000+ Employees,2017,Company - Private,Information Technology Support Services,Information Technology,$5 to $10 billion (USD),0,0,146,234.0,190.0, DC,Washington,7,0,0
670,670,Data Scientist,USD 100K - 110K (Employer est.),"Bachelor’s degree in a related field. Exploratory data analysis: Conducting exploratory data analysis to understand the underlying patterns, trends, and……",3.0,VERUS CLAIMS SERVICES LLC,"Princeton, NJ",51 to 200 Employees,2003,Company - Private,Legal,Legal,Unknown / Non-Applicable,0,0,100,110.0,105.0, NJ,Princeton,21,0,0
673,673,Data Science Practitioner,USD 80K - 150K (Glassdoor est.),"All employment decisions shall be made without regard to age, race, creed, color, religion, sex, national origin, ancestry, disability status, veteran status,……",4.2,Accenture Federal Services,"Washington, DC",10000+ Employees,1989,Subsidiary or Business Segment,Business Consulting,Management & Consulting,Unknown / Non-Applicable,0,0,80,150.0,115.0, DC,Washington,35,0,0
674,674,Conversational AI Specialist,USD 65K - 110K (Employer est.),"Documenting conversational design, dialog flows, wireframes, and templates (flat vs goal-driven) to influence iterative approaches to improve conversational……",3.9,Discover Financial Services,"Riverwoods, IL",10000+ Employees,1985,Company - Public,Banking & Lending,Financial Services,$1 to $5 billion (USD),0,0,65,110.0,87.5, IL,Riverwoods,39,0,0
675,675,Deep Learning Data Science Manager,USD 117K - 161K (Glassdoor est.),"You will be responsible for the technical direction of client engagements while defining the project strategy, communicating complex concepts to both technical……",4.0,Deloitte,"Atlanta, GA",10000+ Employees,1850,Company - Private,Business Consulting,Management & Consulting,$10+ billion (USD),0,0,117,161.0,139.0, GA,Atlanta,174,0,0
676,676,"Data Analyst, Senior Specialist",USD 92K - 127K (Glassdoor est.),"Leads the development of data quality standards, and the tools and methods used to measure and improve data quality.…",3.7,Vanguard,"Malvern, PA",10000+ Employees,1975,Company - Private,Investment & Asset Management,Financial Services,Unknown / Non-Applicable,0,0,92,127.0,109.5, PA,Malvern,49,0,0
679,679,Senior Business Data Analyst,USD 90K - 115K (Glassdoor est.),Ability to use advanced analytic tools to develop predictive models. Responsible for both leading and participating in a team of analysts focused on the……,4.2,TTX,"Charlotte, NC",1001 to 5000 Employees,1955,Company - Private,Rail Transportation,Transportation & Logistics,$1 to $5 billion (USD),0,0,90,115.0,102.5, NC,Charlotte,69,0,0
680,680,Lead Software Engineer- Big Data Streaming,USD 100K - 132K (Glassdoor est.),"Executes creative software solutions, design, development, and technical troubleshooting with ability to think beyond routine or conventional approaches to……",4.0,JPMorgan Chase & Co,"Columbus, OH",10000+ Employees,1799,Company - Public,Banking & Lending,Financial Services,$10+ billion (USD),0,0,100,132.0,116.0, OH,Columbus,225,0,0
681,681,"Senior Performance Software Engineer, Deep Learning Libraries",USD 180K - 339K (Employer est.),"If you're creative, autonomous, and love a challenge, consider joining our Deep Learning Library team and help us build the real-time, cost-effective computing……",4.6,NVIDIA,"Santa Clara, CA",10000+ Employees,1993,Company - Public,Computer Hardware Development,Information Technology,$5 to $10 billion (USD),0,0,180,339.0,259.5, CA,Santa Clara,31,0,0
682,682,Experienced Cleared Data Scientist,USD 111K - 150K (Glassdoor est.),"Manipulating large data sets, data mining, and structuring of raw data using open sources tools such as Python to formulate or recognize patterns to generate……",3.7,Guidehouse,"Washington, DC",1001 to 5000 Employees,2018,Company - Private,Business Consulting,Management & Consulting,Unknown / Non-Applicable,0,0,111,150.0,130.5, DC,Washington,6,1,0
684,684,Cloud Data Engineer - Solution Specialist,USD 74K - 104K (Glassdoor est.),"Generate design, development, test plans, detailed functional specifications documents, user interface design, and process flow charts for execution of……",4.0,Deloitte,"Lake Mary, FL",10000+ Employees,1850,Company - Private,Business Consulting,Management & Consulting,$10+ billion (USD),0,0,74,104.0,89.0, FL,Lake Mary,174,0,0
685,685,"Reliability, Availability and Serviceability Expert, Datacenter AI Products Development",USD 188K - 357K (Employer est.),"Lead the data analysis of RAS/Resilience logs to refine, revise and overhaul test methodology and manufacturing flows; influence and drive software tools……",4.6,NVIDIA,"Santa Clara, CA",10000+ Employees,1993,Company - Public,Computer Hardware Development,Information Technology,$5 to $10 billion (USD),0,0,188,357.0,272.5, CA,Santa Clara,31,0,0
688,688,"Staff Machine Learning Software Engineer, New Initiatives - Remote",USD 181K - 246K (Glassdoor est.),Preferred Qualifications PhD in Computer Science or related field with research in machine learning Experience building 0→1 ML products at large (dropbox-level)……,4.4,Dropbox,"Boston, MA",1001 to 5000 Employees,2007,Company - Public,Computer Hardware Development,Information Technology,Unknown / Non-Applicable,0,0,181,246.0,213.5, MA,Boston,17,0,0
689,689,"Senior Director Data Science, AI Innovation Lab",USD 127K - 173K (Glassdoor est.),"Bachelor's degree and 12 years of work experience in a mathematical, statistical, computer science, engineering, physics, economics, or related quantitative……",4.0,HCSC,"Austin, TX",10000+ Employees,1936,Company - Private,Insurance Carriers,Insurance,Unknown / Non-Applicable,0,0,127,173.0,150.0, TX,Austin,88,0,0
691,691,Data Scientist,USD 80K - 192K (Employer est.),"A degree in a related field (e.g., Computer Information Systems, Engineering), a degree in the physical/hard sciences (e.g. physics, chemistry, biology,……",3.7,National Security Agency,"Fort Meade, MD",Unknown,1962,Government,National Agencies,Government & Public Administration,Unknown / Non-Applicable,0,0,80,192.0,136.0, MD,Fort Meade,62,0,0
693,693,Data Scientist Senior Technical Specialist,USD 146K - 234K (Employer est.),"Requires strong technical and computational skills - engineering, physics, mathematics, coupled with the ability to code design, develop, and deploy……",3.6,Peraton,"Reston, VA",10000+ Employees,2017,Company - Private,Information Technology Support Services,Information Technology,$5 to $10 billion (USD),0,0,146,234.0,190.0, VA,Reston,7,0,0
694,694,"Engineering Manager, Machine Learning",USD 190K - 210K (Employer est.),"Drive the research, design, and implementation of advanced ML and Generative AI algorithms to enhance model capabilities. 401k retirement plan with matching.…",3.7,Vagaro,"Pleasanton, CA",201 to 500 Employees,2009,Company - Private,Internet & Web Services,Information Technology,Unknown / Non-Applicable,0,0,190,210.0,200.0, CA,Pleasanton,15,0,0
695,695,Lead/Senior Bioinformatics Research Scientist- Data Scientist,USD 104K - 186K (Employer est.),"Bachelor's degree in bioinformatics, cheminformatics, statistics/computer science (with a background in biological sciences or chemistry) or related field.…",4.6,St. Jude Children's Research Hospital,"Memphis, TN",5001 to 10000 Employees,1962,Nonprofit Organization,Health Care Services & Hospitals,Healthcare,Unknown / Non-Applicable,0,0,104,186.0,145.0, TN,Memphis,62,0,0
697,697,Data Visualization PowerBI Developer,USD 84K - 112K (Glassdoor est.),"Perform technical risk analysis and reliability assessments. The Artificial Intelligence & Data Engineering team leverages the power of data, analytics,……",4.0,Deloitte,"Gilbert, AZ",10000+ Employees,1850,Company - Private,Business Consulting,Management & Consulting,$10+ billion (USD),0,0,84,112.0,98.0, AZ,Gilbert,174,0,0
698,698,Data Visualization PowerBI Developer,USD 78K - 107K (Glassdoor est.),"Perform technical risk analysis and reliability assessments. The Artificial Intelligence & Data Engineering team leverages the power of data, analytics,……",4.0,Deloitte,"Lake Mary, FL",10000+ Employees,1850,Company - Private,Business Consulting,Management & Consulting,$10+ billion (USD),0,0,78,107.0,92.5, FL,Lake Mary,174,0,0
701,701,Data Visualization PowerBI Developer,USD 71K - 96K (Glassdoor est.),"Perform technical risk analysis and reliability assessments. The Artificial Intelligence & Data Engineering team leverages the power of data, analytics,……",4.0,Deloitte,"Lake Mary, FL",10000+ Employees,1850,Company - Private,Business Consulting,Management & Consulting,$10+ billion (USD),0,0,71,96.0,83.5, FL,Lake Mary,174,0,0
702,702,Data Scientist Technical Specialist,USD 146K - 234K (Employer est.),The candidate for this role will be involved in the analysis of unstructured and semi-structured data. Candidate selected must have an active TS/SCI clearance……,3.6,Peraton,"Reston, VA",10000+ Employees,2017,Company - Private,Information Technology Support Services,Information Technology,$5 to $10 billion (USD),0,0,146,234.0,190.0, VA,Reston,7,0,0
703,703,Lead Software Engineer - Big Data PySpark/PySQL,USD 98K - 136K (Glassdoor est.),"Executes creative software solutions, design, development, and technical troubleshooting with ability to think beyond routine or conventional approaches to……",4.0,JPMorgan Chase & Co,"Plano, TX",10000+ Employees,1799,Company - Public,Banking & Lending,Financial Services,$10+ billion (USD),0,0,98,136.0,117.0, TX,Plano,225,0,0
704,704,Lead Software Engineer - Data,USD 100K - 136K (Glassdoor est.),"Executes creative software solutions, design, development, and technical troubleshooting with ability to think beyond routine or conventional approaches to……",4.0,JPMorgan Chase & Co,"Plano, TX",10000+ Employees,1799,Company - Public,Banking & Lending,Financial Services,$10+ billion (USD),0,0,100,136.0,118.0, TX,Plano,225,0,0
705,705,TSS Data Scientist,USD 82K - 114K (Glassdoor est.),Leverage large sets of structured and unstructured data to develop tools and techniques for robust data analysis. HOW A DATA SCIENTIST WILL MAKE AN IMPACT.…,3.9,General Dynamics Information Technology,"Bossier City, LA",10000+ Employees,1996,Subsidiary or Business Segment,Information Technology Support Services,Information Technology,$10+ billion (USD),0,0,82,114.0,98.0, LA,Bossier City,28,0,0
706,706,Research Data Scientist - Center for Health Data Science & Analytics,USD 73K - 115K (Glassdoor est.),"O Master’s degree in computer science, Clinical Informatics, Public Health Administration, Business Administration, or Engineering, or an MD with experience in……",4.3,Houston Methodist Academic Institute,"Houston, TX",10000+ Employees,1919,Nonprofit Organization,Health Care Services & Hospitals,Healthcare,Unknown / Non-Applicable,0,0,73,115.0,94.0, TX,Houston,105,0,0
707,707,Senior Marketing Data Analyst,USD 66K - 95K (Glassdoor est.),Serves as project management lead on implementation of marketing visualization tools. Runs deep-dive analysis and answers ad-hoc business questions to drive……,4.2,Insperity,"Kingwood, TX",1001 to 5000 Employees,1986,Company - Public,Business Consulting,Management & Consulting,$5 to $25 million (USD),0,0,66,95.0,80.5, TX,Kingwood,38,0,0
708,708,Data Science Opportunities,USD 132K - 204K (Glassdoor est.),"Leads technical work of a scrum team: initiating and designing model solutions, driving end-to-end architecture designs of the team’s work, and holding the team……",4.4,Intuit,"Atlanta, GA",10000+ Employees,1983,Company - Public,Software Development,Information Technology,$10+ billion (USD),0,0,132,204.0,168.0, GA,Atlanta,41,0,0
710,710,Lead Software Engineer - AWS/Machine Learning,USD 117K - 158K (Glassdoor est.),"Executes creative software solutions, design, development, and technical troubleshooting with ability to think beyond routine or conventional approaches to……",4.0,JPMorgan Chase & Co,"Houston, TX",10000+ Employees,1799,Company - Public,Banking & Lending,Financial Services,$10+ billion (USD),0,0,117,158.0,137.5, TX,Houston,225,0,0
714,714,Machine Learning Engineer,USD 77K - 113K (Glassdoor est.),Demonstrated success applying advanced statistical methods and machine learning algorithms to production/field data using Python or R.…,3.2,Howmet Aerospace,"Whitehall, MI",Unknown,1888,Company - Public,Aerospace & Defense,Aerospace & Defense,Unknown / Non-Applicable,0,0,77,113.0,95.0, MI,Whitehall,136,1,0
715,715,"VP, Gen AI Architecture Leader",USD 150K - 250K (Employer est.),"Extensive leadership experience in AI, machine learning, or a related technical field. Degree in Computer Science, Artificial Intelligence, or a related field.…",4.2,Synchrony Financial,"Stamford, CT",10000+ Employees,2014,Company - Public,Banking & Lending,Financial Services,$10+ billion (USD),0,0,150,250.0,200.0, CT,Stamford,10,0,0
716,716,Consumer Products/Retail Data Science Manager,USD 82K - 143K (Glassdoor est.),"You will be responsible for the technical direction of client engagements while defining the project strategy, communicating complex concepts to both technical……",4.0,Deloitte,"Tampa, FL",10000+ Employees,1850,Company - Private,Business Consulting,Management & Consulting,$10+ billion (USD),0,0,82,143.0,112.5, FL,Tampa,174,0,0
719,719,Cloud Data Engineer - Solution Specialist,USD 81K - 112K (Glassdoor est.),"Generate design, development, test plans, detailed functional specifications documents, user interface design, and process flow charts for execution of……",4.0,Deloitte,"Gilbert, AZ",10000+ Employees,1850,Company - Private,Business Consulting,Management & Consulting,$10+ billion (USD),0,0,81,112.0,96.5, AZ,Gilbert,174,0,0
720,720,"Engineer, Generative AI",USD 160K - 190K (Employer est.),"Conduct research, design, and develop generative AI-driven features and experiences customized to the unique preferences and behaviors of our users.…",3.7,Vagaro,"Pleasanton, CA",201 to 500 Employees,2009,Company - Private,Internet & Web Services,Information Technology,Unknown / Non-Applicable,0,0,160,190.0,175.0, CA,Pleasanton,15,0,0
721,721,Data Scientist,USD 97K - 160K (Glassdoor est.),10+ years’ experience in Data Science or related field. The incumbent will assist with definition and implementation of data analysis and data modeling……,3.2,Quirch Foods,"Coral Gables, FL",201 to 500 Employees,1967,Company - Private,Wholesale,Retail & Wholesale,$500 million to $1 billion (USD),0,0,97,160.0,128.5, FL,Coral Gables,57,0,0
722,722,Data Scientist,USD 105K - 143K (Glassdoor est.),"Master’s Degree in Statistics, Data Science or related field. You will work collaboratively with data engineers and data mappers to design, build and scale our……",3.7,CARFAX,"Columbia, MO",1001 to 5000 Employees,1984,Company - Public,Internet & Web Services,Information Technology,Unknown / Non-Applicable,0,0,105,143.0,124.0, MO,Columbia,40,0,0
723,723,Data Scientist - Human Resources -,USD 132K - 209K (Glassdoor est.),Strong communication skills with the ability to explain complex technical concepts to non-technical audiences.…,3.3,AutoNation Headquarters,"Fort Lauderdale, FL",10000+ Employees,1996,Company - Public,Vehicle Dealers,Retail & Wholesale,$10+ billion (USD),0,0,132,209.0,170.5, FL,Fort Lauderdale,28,0,0
724,724,Data Visualization PowerBI Developer,USD 77K - 101K (Glassdoor est.),"Perform technical risk analysis and reliability assessments. The Artificial Intelligence & Data Engineering team leverages the power of data, analytics,……",4.0,Deloitte,"Gilbert, AZ",10000+ Employees,1850,Company - Private,Business Consulting,Management & Consulting,$10+ billion (USD),0,0,77,101.0,89.0, AZ,Gilbert,174,0,0
727,727,Sr.Data Science Associate- Consumer Lending,USD 77K - 125K (Glassdoor est.),"Presents results of analyses to business units, explain technical and statistical concepts to non-technical/non-statistical associates and vice-versa.…",3.8,Santander Holdings USA Inc,"Boston, MA",5001 to 10000 Employees,1856,Company - Private,Banking & Lending,Financial Services,$500 million to $1 billion (USD),0,0,77,125.0,101.0, MA,Boston,168,0,0
728,728,Head of Corporate Technology Intelligent Systems Data and Analytics- Senior Principal Data Architect,USD 233K - 325K (Employer est.),Bachelor's degree in Computer Science or related Math or Engineering field. 10+ years of managing diverse and technical Information Architecture and Data……,4.0,JPMorgan Chase & Co,"Houston, TX",10000+ Employees,1799,Company - Public,Banking & Lending,Financial Services,$10+ billion (USD),0,0,233,325.0,279.0, TX,Houston,225,0,0
729,729,Experimentation Data Scientist,USD 198K - 260K (Employer est.),"Advanced degree in a quantitative field like statistics, economics, computer science, operations research, or engineering; or relevant work experience.…",3.7,Rokt,"New York, NY",201 to 500 Employees,2012,Company - Private,Internet & Web Services,Information Technology,Unknown / Non-Applicable,0,0,198,260.0,229.0, NY,New York,12,0,0
730,730,Principal Data Science,USD 127K - 177K (Employer est.),"Operates as a subject matter expert on statistical analysis, test and design of experiment, analysis methodology, modeling & application, and financial impact……",3.9,Discover Financial Services,"Riverwoods, IL",10000+ Employees,1985,Company - Public,Banking & Lending,Financial Services,$1 to $5 billion (USD),0,0,127,177.0,152.0, IL,Riverwoods,39,0,0
732,732,"Associate Director, Commercial Data Science",USD 95K - 160K (Glassdoor est.),"Highly independent with the ability to develop innovative solutions to complex, unstructured problems. Strong background in data science, commercial analytics,……",4.2,Genmab,"Princeton, NJ",1001 to 5000 Employees,1999,Company - Public,Biotech & Pharmaceuticals,Pharmaceutical & Biotechnology,$1 to $5 billion (USD),0,0,95,160.0,127.5, NJ,Princeton,25,0,0
735,735,Solutions Architect (Artificial Intelligence),USD 150.00 - 200.00 Per Hour (Employer est.),"Strong communication and collaboration skills, with the ability to effectively convey complex technical concepts to both technical and non-technical……",4.0,"Tentek, Inc.","Culver City, CA",51 to 200 Employees,1992,Company - Private,Business Consulting,Management & Consulting,$5 to $25 million (USD),1,0,150,200.0,175.0, CA,Culver City,32,0,0
736,736,Senior Data Scientist,USD 125K - 164K (Glassdoor est.),"Leading design and development of data visualization and dashboard solutions to provide required analytics insights using tools such as Tableau, Power BI, and……",3.7,Guidehouse,"McLean, VA",1001 to 5000 Employees,2018,Company - Private,Business Consulting,Management & Consulting,Unknown / Non-Applicable,0,0,125,164.0,144.5, VA,McLean,6,0,0
737,737,"Senior Data Analyst (Manager, ERAS Data)",USD 86K - 114K (Glassdoor est.),Offer on-the-spot technical support to the development team by solving data pipelines or issues with data visualization tools as needed during these events.…,4.5,Association of American Medical Colleges,"Washington, DC",501 to 1000 Employees,1876,Nonprofit Organization,Health Care Services & Hospitals,Healthcare,$100 to $500 million (USD),0,0,86,114.0,100.0, DC,Washington,148,0,0
738,738,Senior Investment Data Analyst,USD 92K - 157K (Glassdoor est.),Ability to develop and maintain relationships with internal and external clients and stakeholders at all levels in the organization.…,3.7,Vanguard,"Malvern, PA",10000+ Employees,1975,Company - Private,Investment & Asset Management,Financial Services,Unknown / Non-Applicable,0,0,92,157.0,124.5, PA,Malvern,49,0,0
741,741,Expert Generative AI Prompt Engineer,USD 140K - 175K (Employer est.),"5+ years of professional experience in fields of language and human-computer interaction (i.e: linguistics, cognitive sciences, data science, psychology,……",3.9,Nestlé Purina Pet Care,"Saint Louis, MO",10000+ Employees,1894,Subsidiary or Business Segment,Consumer Product Manufacturing,Manufacturing,Unknown / Non-Applicable,0,0,140,175.0,157.5, MO,Saint Louis,130,0,0
743,743,"Director, Architecture and Engineering, AI Products",USD 107K - 171K (Glassdoor est.),"Bachelor’s or master’s degree in computer science, engineering, Information Technology, or a related field. 10+ years of experience driving successful software……",4.2,Genmab,"Princeton, NJ",1001 to 5000 Employees,1999,Company - Public,Biotech & Pharmaceuticals,Pharmaceutical & Biotechnology,$1 to $5 billion (USD),0,0,107,171.0,139.0, NJ,Princeton,25,0,0
